display_name|website_url|source_url|primary_metro|service_area|contact_name|email|phone|evidence
APW Hoods INC|https://apwhoodsinc.com/services/hood-cleaning|https://apwhoodsinc.com/contact|Paso Robles|Paso Robles, Atascadero, Morro Bay, and nearby Central Coast commercial kitchens||Absolutepowerwash.2009@gmail.com|805-621-2674|Central Coast hood cleaning operator with hood cleaning, kitchen exhaust cleaning, grease duct cleaning, direct Gmail route, and explicit Paso Robles-area commercial kitchen coverage.
Florida Kitchen Pros|https://floridakitchenpros.com/|https://about.me/floridakitchen|Dade City|Dade City, Lakeland, Tampa, and nearby Central Florida commercial kitchens||info@floridakitchenpros.com|352-437-3553|Central Florida operator with kitchen exhaust hood cleaning, commercial kitchen cleaning, code compliance positioning, direct company inbox, and explicit restaurant service fit.
Kansas City Hood Cleaning|https://kansascityprohoodcleaning.com/|https://about.me/kansascityhood|Kansas City|Kansas City, Overland Park, Olathe, and nearby Kansas City metro commercial kitchens|Conor Mack|kchoodmike@gmail.com|913-228-3386|Kansas City hood cleaning company with kitchen hood cleaning, kitchen exhaust cleaning, vent hood cleaning, owner-named contact, and direct Gmail route.
Chicago Hood Cleaning|https://chicagohoodcleaning.net/|https://chicagohoodcleaning.net/find-us-on-the-web/|Chicago|Chicago, Cicero, Berwyn, and nearby Chicagoland commercial kitchens||art2862@yahoo.com|779-243-5188|Chicagoland hood cleaning operator with restaurant hood cleaning, commercial kitchen exhaust cleaning, direct Yahoo inbox, and explicit Chicago area service fit.
Kanela Professional Kitchen Exhaust Cleaning|https://kanela.us/|https://www.ezlocal.com/tx/houston/commercial-cleaning-services/0916734030/|Houston|Houston, Sugar Land, Katy, and nearby Greater Houston commercial kitchens||mykanela@gmail.com|832-880-1338|Houston kitchen exhaust cleaning company with hood cleaning, commercial kitchen cleaning, direct Gmail route, and explicit Greater Houston service fit.
Equi Vac LLC|https://www.equivac.net/|https://www.equivac.net/services|Lansing|Lansing, Jackson, Ann Arbor, and nearby Mid-Michigan commercial kitchens||equivac@gmail.com|517-759-4628|Michigan kitchen exhaust cleaning operator with hood cleaning, kitchen exhaust cleaning, direct Gmail route, and explicit Mid-Michigan commercial kitchen service fit.
Shipman Cleaning Co|https://shipmancleaningco.com/|https://trustedpros.com/company/shipman-cleaning-co|Phoenix|Phoenix, Tempe, Scottsdale, and nearby Greater Phoenix commercial kitchens||office@shipmancleaningco.com|480-599-3378|Phoenix operator with commercial kitchen hood cleaning, exhaust hood service, direct company inbox, and explicit Greater Phoenix restaurant service fit.
Discount Hood Cleaning|https://www.discounthoodcleaningak.com/|https://www.discounthoodcleaningak.com/contact-us|Anchorage|Anchorage, Fairbanks, Kenai Peninsula, and nearby Alaska commercial kitchens||sales.dhc.ak@gmail.com|907-764-0266|Alaska hood cleaning operator with hood cleaning, commercial client focus, fire-safety positioning, direct Gmail route, and explicit Anchorage-area commercial kitchen coverage.
MRJ Maintenance|https://mrjmaintenance.com/|https://mrjmaintenance.com/|Placerville|Placerville, Sacramento, Folsom, and nearby Sierra foothill commercial kitchens||sales@mrjmaintenance.com|530-622-4627|Northern California operator with hood cleaning, commercial kitchen cleaning, direct sales inbox, and explicit restaurant equipment cleaning fit.
ProClean Building Maintenance|https://procleanhoods.com/|https://procleanhoods.com/|Sacramento|Sacramento, Elk Grove, Roseville, and nearby Sacramento area commercial kitchens||admin@procleanbm.co|916-663-3033|Sacramento area hood cleaning operator with hood cleaning, commercial kitchen service, direct admin inbox, and explicit Sacramento market fit.
Monster Wash Services|https://www.monsterwashservices.com/|https://www.monsterwashservices.com/commercial-kitchen-hood-cleaning-services/|Wausau|Wausau, Stevens Point, Wisconsin Rapids, and nearby Central Wisconsin commercial kitchens||kw.hampton01@gmail.com|715-450-0143|Central Wisconsin hood cleaning operator with commercial kitchen hood cleaning, direct Gmail route, and explicit restaurant exhaust service fit.
In the Hood|https://www.inthehoodllc.com/|https://www.inthehoodllc.com/contact-us|Salt Lake City|Salt Lake City, Provo, Ogden, and nearby Utah commercial kitchens||inthehood444@gmail.com|435-730-9485|Utah kitchen exhaust cleaning operator with bare-metal hood cleaning, NFPA 96 positioning, direct Gmail route, and explicit Utah commercial kitchen service fit.
Vent Max Services LLC|https://ventmaxservices.com/services.html|https://ventmaxservices.com/nfpa-96-standard.html|Newark|Newark, Elizabeth, Jersey City, and nearby North Jersey commercial kitchens||info@ventmaxservices.com|973-518-6946|New Jersey hood cleaning operator with NFPA 96 compliant kitchen exhaust hood cleaning, direct company inbox, and explicit statewide commercial kitchen fire-safety coverage.
Badger Mobile Wash|https://badgermobilewashllc.com/|https://badgermobilewashllc.com/expert-kitchen-hood-exhaust-cleaning-in-wisconsin/|Wausau|Wausau, Eau Claire, Wisconsin Rapids, and nearby Wisconsin commercial kitchens||Steve@BadgerMobileWashLLC.com|715-630-6500|Wisconsin hood and exhaust cleaning operator with kitchen hood exhaust cleaning, direct owner inbox, and explicit restaurant service fit.
Hood Pursuit LLC|https://www.hoodpursuit.com/|https://www.hoodpursuit.com/contact|Harrisburg|Harrisburg, Hershey, Lancaster, Reading, Lebanon, Allentown, and nearby Central & Eastern Pennsylvania commercial kitchens||hoodpursuitcleaning@gmail.com|610-925-8925|Pennsylvania hood cleaning operator with commercial kitchen exhaust cleaning, NFPA-96 focused documentation, direct Gmail route, and explicit Central & Eastern Pennsylvania service coverage.
Pristine Hood Cleaning, LLC|https://www.pristinehoodcleaning.com/about-us|https://www.pristinehoodcleaning.com/services|Pittsburgh|Pittsburgh, Western Pennsylvania, Eastern Ohio, and Northern West Virginia commercial kitchens||D.Pristinehc@gmail.com|412-676-8816|Pittsburgh hood cleaning operator with NFPA 96 compliant kitchen hood and exhaust cleaning, direct Gmail route, and explicit tri-state commercial kitchen coverage.
All American Certified Restaurant Hood Cleaning|https://allamericanservices.biz/|https://allamericanservices.biz/contact/|Boston|Boston, Brockton, Quincy, and nearby Greater Boston commercial kitchens||allamericanservices.biz@gmail.com|781-888-3055|Greater Boston restaurant hood cleaning operator with certified hood cleaning, direct Gmail route, and explicit commercial kitchen service fit.
Cleaning Pros Plus|https://www.cleaningprosplus.com/|https://www.cleaningprosplus.com/|Stockton|Stockton, Modesto, Tracy, and nearby Central Valley commercial kitchens||sales@cprosplus.com|209-318-2737|Central Valley kitchen exhaust cleaning operator with IKECA-certified kitchen exhaust cleaning, NFPA 96 positioning, direct sales inbox, and explicit California commercial kitchen fit.
A-1 Hood Cleaning|https://commercialhoodcleaner.net/|https://nextdoor.com/pages/a-1-tn-state-hood-cleaning-antioch-tn/|Nashville|Nashville, Antioch, Murfreesboro, and nearby Middle Tennessee commercial kitchens||tnstatehood@gmail.com|615-367-6560|Middle Tennessee hood cleaning operator with commercial hood cleaning, direct Gmail route, and explicit Nashville market fit.
Extreme Cleaning|https://extremecleaningusa.com/locations/florida/orlando/kitchen-hood/|https://extremecleaningusa.com/find-us-on-the-web/|Orlando|Orlando, Kissimmee, Sanford, and nearby Central Florida commercial kitchens||info@extremecleaningusa.com|800-397-8912|Orlando kitchen hood cleaning operator with hood cleaning, restaurant exhaust service, direct company inbox, and explicit Orlando area service fit.
M&B Hood Masters|https://www.hoodmastersllc.com/contact-us/|https://www.hoodmastersllc.com/contact-us/|Greenville|Greenville, New Bern, Jacksonville, and nearby Eastern North Carolina commercial kitchens||mbhoodmastersllc@gmail.com|252-213-0799|Eastern North Carolina hood cleaning operator with commercial kitchen exhaust cleaning, direct Gmail route, and explicit coastal Carolina service fit.
Cleaning Expert LLC|https://cleaningexpertstl.com/|https://nextdoor.com/pages/cleaning-expert-llc-arnold-mo/|St. Louis|St. Louis, Arnold, St. Charles, and nearby Metro St. Louis commercial kitchens||cleaningexpert05@gmail.com|314-814-5379|Metro St. Louis hood cleaning operator with hood cleaning, commercial kitchen service, direct Gmail route, and explicit St. Louis market fit.
Hood Cleaners of America|https://www.hoodcleanersofamerica.com/|https://about.me/hoodcleanersofameric|Tampa|Palm Harbor, Clearwater, Tampa, and nearby Pinellas commercial kitchens||info@hoodcleanersofamerica.com|866-696-7969|Florida kitchen exhaust cleaning company with IKECA certification, NFPA 96 positioning, direct company inbox, and explicit Tampa Bay commercial kitchen fit.
New York Hood Cleaning|http://www.newyorkhoodcleaning.net|https://about.me/newyorkhoodcleaning|New York City|New York City, Brooklyn, Queens, and nearby NYC commercial kitchens||contact@newyorkhoodcleaning.net|917-746-5036|NYC hood cleaning operator with kitchen hood cleaning, restaurant hood cleaning, direct company inbox, and explicit New York City commercial kitchen fit.
Elite Hood Cleaning, LLC|https://www.elitehoodcleaning.net/kitchen-exhaust-hood-cleaning|https://www.elitehoodcleaning.net/faqs|Manchester|Manchester, Southern New Hampshire, and nearby New England commercial kitchens||Theelitehoodcleaningllc@gmail.com|603-361-5010|New England hood cleaning operator with NFPA 96 compliant kitchen exhaust hood cleaning, fully insured positioning, direct Gmail route, and explicit multi-state commercial kitchen coverage.
