display_name|website_url|source_url|primary_metro|service_area|contact_name|email|phone|evidence
Good Hoods, LLC|https://goodhoods.us/|https://goodhoods.us/about-us/|Harrisburg|Mechanicsburg, Harrisburg, Camp Hill, Carlisle, and surrounding Central Pennsylvania commercial kitchens||info@goodhoods.us|223-259-4748|Veteran-owned and operated Mechanicsburg company whose official site centers on commercial kitchen hood exhaust system cleaning, publishes a direct company inbox, and serves the greater Harrisburg area with hood, fan, and filter service.
Mid-South Clean Machine, Inc.|https://mid-southcleanmachine.com/|https://mid-southcleanmachine.com/|Jonesboro|Jonesboro, Little Rock, Memphis, Southaven, Sikeston, and broader Arkansas, West Tennessee, Southeast Missouri, and North Mississippi commercial kitchens||midsouthcleanmachine@gmail.com|870-761-1850|Privately owned Mid-South operator whose official site says it holds Certified Commercial Kitchen Exhaust Cleaner certification #0053, has operated since 1999, and provides vent hood cleaning across Arkansas, West Tennessee, Southeast Missouri, and North Mississippi with a direct public Gmail.
HDA Degreasing, Inc.|https://www.hdadegreasing.com/|https://www.hdadegreasing.com/about/|New Orleans|New Orleans, Covington, Mandeville, Houma, Thibodaux, Baton Rouge, Hammond, Lafayette, and South Louisiana plus Mississippi commercial kitchens||info@hdadegreasers.com|504-373-5600|New Orleans-based operator organized in 1988 whose official site says it provides hood exhaust systems cleaning for restaurants and other commercial businesses across South Louisiana and Mississippi and exposes a direct company inbox.
Aloha Kitchen Exhaust Service Inc.|https://alohaexhaust.com/|https://alohaexhaust.com/|Lubbock|Lubbock County and surrounding West Texas commercial kitchens||info@alohaexhaust.com|806-632-0024|Certified West Texas kitchen-exhaust specialist whose official site says it is the Lubbock County area's commercial kitchen exhaust system and hood cleaning company, explicitly lists exhaust fan cleaning, grease duct cleaning, kitchen hood cleaning, NFPA 96 inspection guidance, and publishes a direct company inbox.
Vent Pro TX Kitchen Cleaning|https://ventprotx.com/|https://ventprotx.com/|Huntsville|Huntsville, Conroe, Madisonville, Bryan, College Station, Fairfield, and surrounding Central and Southeast Texas commercial kitchens||info@ventprotx.com|936-662-2228|Texas kitchen-exhaust operator whose official site says it sets the benchmark for kitchen exhaust and restaurant cleaning in Central and Southeast Texas, lists explicit service areas, guarantees NFPA 96 inspection readiness, and exposes a direct company inbox.
BARE METAL SOLUTIONS, LLC|https://www.baremetalsolutions.com/|https://www.baremetalsolutions.com/contact|Springdale|Rogers, Fayetteville, Bentonville, Siloam Springs, Springdale, Bella Vista, Eureka Springs, and greater Northwest Arkansas commercial kitchens||baremetalllc@gmail.com|479-935-9272|Local Northwest Arkansas operator whose official site says it provides NFPA 96 commercial kitchen exhaust hood cleaning from hood to roof fan, lists explicit NWA restaurant coverage, and exposes a direct public Gmail and phone.
Commercial Equipment Solutions|https://cleanhoodvents.com/|https://cleanhoodvents.com/|Little Rock|Little Rock, North Little Rock, Maumelle, Conway, Sherwood, Jacksonville, Cabot, Searcy, Benton, Bryant, Hot Springs, and broader Arkansas commercial kitchens||info@cleanhoodvents.com|501-800-7607|Arkansas restaurant-focused operator whose official site lists exhaust hood cleaning to NFPA 96 code standards, weekly filter service, a direct public inbox, and explicit Central Arkansas restaurant coverage.
