display_name|website_url|source_url|primary_metro|service_area|contact_name|email|phone|evidence
Cooking Clean|https://www.cookingcleanco.com/|https://www.cookingcleanco.com/|Albuquerque|Albuquerque, Moriarty, Santa Fe, Rio Rancho, and greater New Mexico commercial kitchens||patriotshaney99@gmail.com|505-400-1676|Family-owned kitchen hood cleaning company serving the greater Albuquerque area; Phil Ackland kitchen exhaust cleaning certified; NFPA 96 compliant; commercial kitchen and local business focus.
Steadfast Hood Cleaning|https://www.steadfasthoodcleaning.com/|https://www.steadfasthoodcleaning.com/|Albuquerque|Albuquerque, New Mexico, El Paso, and Southern Colorado commercial kitchens||steadfasthoodcleaning@gmail.com|505-903-0157|Commercial kitchen exhaust cleaning and hood cleaning company; 15 years experience; NFPA 96 standards; deep cleaning and quote route for restaurant operators.
KB Commercial Cleaning|https://kbcommercialcleaning.org/|https://kbcommercialcleaning.org/|Albany|Albany, Schenectady, Troy, Saratoga Springs, Clifton Park, and nearby commercial kitchens||kbcommercialcleaning1@gmail.com|518-548-0777|Commercial kitchen hood and exhaust cleaning for restaurants; degreasing hoods, filters, exhaust ducts, and fans; practical local provider with quote route.
H2O Kitchen Exhaust Cleaning|https://h2okitchenexhaustcleaning.com/|https://h2okitchenexhaustcleaning.com/|Charleston|Greater Charleston area restaurants and commercial hoods||h2owash@yahoo.com|843-553-4490|Commercial kitchen hood cleaning specialist for the greater Charleston area; kitchen exhaust cleaning, pressure washing, and hood degreasing for restaurant operators.
Carolina Exhaust Hood Cleanings|https://www.carolinaexhausthoodcleanings.com/|https://www.carolinaexhausthoodcleanings.com/|Charleston|Charleston and Southern Carolina commercial kitchens||carolinaexhausthoodcleanings@gmail.com|843-619-0019|Commercial hood and exhaust cleaning company focused on restaurant safety; free quote route; local founder signal and kitchen exhaust specialization.
Sun Devil Hoods & Exhaust Cleaning|https://www.sundevilhoods.com/|https://www.sundevilhoods.com/contact/|Phoenix|Phoenix, Tempe, Scottsdale, Mesa, Glendale, and Arizona commercial kitchens||info@sundevilhoods.com|602-900-8060|Family-owned commercial kitchen hood and exhaust cleaning company since 1986; IKECA certified; NFPA 96 compliant; before and after documentation and free estimate route.
Empire Hoods|https://empirehoods.com/|https://empirehoods.com/|New York City|Manhattan restaurants, hotels, food halls, and New York City commercial kitchens||team@empirehoods.com|332-301-2904|FDNY certified commercial kitchen hood cleaning for NYC restaurants; NFPA 96 compliant hood, duct, exhaust fan, and fire suppression services; inspection-ready documentation.
Long Island Hood Cleaning|https://www.longislandhoodcleaning.com/|https://www.longislandhoodcleaning.com/|Long Island|Nassau and Suffolk County restaurants and commercial kitchens||lihoodcleaning@gmail.com|631-848-5864|Professional hood cleaning and filter cleaning for Long Island restaurants and commercial kitchens; licensed and insured; code-compliant results and free consultation.
Long Island Fire Control|https://longislandfirecontrol.com/|https://longislandfirecontrol.com/contact-us/|Long Island|Long Island restaurants and commercial kitchens across Nassau and Suffolk counties||lifirecontrol@gmail.com|631-704-3570|NFPA 96 compliant commercial kitchen hood cleaning with certified technicians; hoods, ducts, grease traps, and exhaust fans; 24/7 emergency service and quote route.
Commercial Kitchen Cleaning Services LLC|https://commercialkitchenclean.com/|https://commercialkitchenclean.com/|South Jersey|Cape May County and South Jersey restaurants and commercial kitchens|Rob Augustinos|info@commercialkitchenclean.com|609-463-9080|Commercial kitchen hood cleaning and hood and exhaust cleaning trusted for over 30 years; kitchen exhaust, filter exchange, appliance cleaning, and owner route under new ownership; safety and compliance focus.
Ohio Hood Cleaning Services LLC|https://www.ohiohoodcleaning.com/resturanthoodcleaning/|https://www.ohiohoodcleaning.com/resturanthoodcleaning/contact/|Cleveland|Cleveland, Akron, Lorain County, and northern Ohio restaurants|Mike|Mike@OhioHoodCleaning.com|440-308-7008|Family-owned restaurant exhaust hood cleaning specialist; commercial kitchen hood cleaning, hot pressure washing, fan repairs, and quote route for Ohio operators.
Hydro Clean Services|https://www.hydrocleanhoodcleaning.com/|https://www.hydrocleanhoodcleaning.com/contact.html|Jackson|Jackson metro, Richland, and Mississippi commercial kitchens||tu@hydrocleanhoodcleaning.com|601-573-1141|Commercial kitchen exhaust hood cleaning specialist for the Jackson metro; hood cleaning, filter replacement, and fan repair; NFPA 96 compliant cleaning and quote route.
Huntsville Hood Cleaning LLC|https://www.hsvhoods.com/|https://www.hsvhoods.com/contact|Huntsville|Huntsville and North Alabama commercial kitchens||hsvhoods@gmail.com|256-604-2792|Local commercial kitchen exhaust cleaner dedicated to keeping kitchens clean and compliant; hood cleaning specialist with free estimate and fast scheduling.
Certified Hood & Fire Specialists|https://certifiedhoodandfire.com/|https://certifiedhoodandfire.com/|Mobile|Mobile, Foley, Biloxi, Gulfport, Pascagoula, and Gulf Coast commercial kitchens|Beazer McMichael|sales@certifiedhoodandfire.com|251-581-7131|Commercial kitchen exhaust hood cleaning and fire prevention specialist; NFPA codes and standards; hood cleaning, fire suppression, and preventive maintenance for restaurants.
Steam Force|https://www.steamforcecleaning.com/|https://www.steamforcecleaning.com/|Knoxville|Knoxville and East Tennessee restaurants, schools, hospitals, churches, and convention centers||service@steamforcecleaning.com|865-660-4547|Commercial kitchen exhaust hood cleaning company established in 2003; IKECA standards and NFPA 96 adherence; Knoxville restaurant hood cleaning with contact route.
Inferno Pressure Washing Solutions|https://www.infernopws.com/|https://www.infernopws.com/services|Cincinnati|Cincinnati, Dayton, and Northern Kentucky restaurants and commercial kitchens||InfernoPWS@gmail.com|513-400-5545|NFPA 96 certified hood and exhaust cleaning for restaurants and commercial kitchens; IKECA trained team; photo reports and free quote route.
Columbia Fire Protection|https://columbiafireprotection.com/|https://columbiafireprotection.com/|Tri-Cities|Tri-Cities and surrounding Washington commercial kitchens||info@columbiafireprotection.com|509-491-3440|IKECA certified kitchen exhaust cleaning and fire suppression maintenance; NFPA 96 compliant commercial hood cleaning for Tri-Cities restaurants and commercial kitchens.
Oklahoma Kitchen Exhaust Cleaning, LLC|https://www.okecs.com/|https://www.okecs.com/locations/wichita-ks|Wichita|Wichita, Derby, Winfield, Arkansas City, and southern Kansas commercial kitchens||dmccann@okecs.com|405-496-4002|Locally owned kitchen hood and exhaust cleaning company serving Wichita with food-grade degreasers, high-pressure hot water, and NFPA 96 compliant cleaning from top to bottom.
Superior Hood and Vent Company|https://superiorhvc.com/|https://superiorhvc.com/|Bakersfield|Bakersfield and surrounding California commercial kitchens||superiorhoodandvent@gmail.com|661-203-7669|Locally owned kitchen hood and vent cleaning specialist in Bakersfield; NFPA certified staff; kitchen exhaust cleaning, grease duct cleaning, and exhaust fan cleaning with 24 hour service.
Steam Works|https://www.steamworksaz.com/|https://www.steamworksaz.com/|Tucson|Tucson and surrounding Arizona restaurants and commercial kitchens|Travis|travis@steamworksaz.com|520-235-8110|Restaurant hood cleaning and kitchen equipment detailing company founded by Tucson-born owner Travis; local restaurant cleaning focus with fire-code minded service and 24/7 route.
Knight Service Company|https://www.knightserviceco.com/|https://www.knightserviceco.com/contact/|Tucson|Tucson and Southern Arizona commercial kitchens||info@knightserviceco.com|520-777-3957|Locally owned hood cleaning company for Tucson and Southern Arizona; professional hood exhaust system cleaning, free estimate route, and kitchen-focused service process.
Apex Hood Cleaning|https://www.apexhoodcleaning.com/|https://www.apexhoodcleaning.com/restaurant-hood-cleaning-boise-id/|Boise|Boise, Garden City, Meridian, Eagle, Nampa, Caldwell, and Treasure Valley commercial kitchens||info@apexhoodcleaning.com|208-486-5753|Professional hood and exhaust cleaning services for Boise restaurants; NFPA 96 compliance, detailed inspection reports, before and after photo documentation, and scheduled maintenance.
Salt City Fire|https://saltcityfire.com/|https://saltcityfire.com/commercial-hood-cleaning/|Salt Lake City|Salt Lake City, Park City, and Utah commercial kitchens||steve@saltcityfire.com|801-674-0933|Commercial hood cleaning for restaurants, food trucks, institutions, and commercial kitchens; NFPA 96 compliant hood cleaning with schedule and contact route.
CleanCo WA|https://cleanco-wa.com/|https://cleanco-wa.com/service/hood-vent-cleaning/|Spokane|Spokane, Spokane Valley, Liberty Lake, Post Falls, and Coeur d'Alene commercial kitchens||info@cleanco-wa.com|509-892-1922|Family-owned Spokane hood vent cleaning company since 2011; certified commercial kitchen exhaust system cleaning; NFPA 96 documentation and free estimate route.
Tulsa Vent Hood|https://www.tulsaventhood.com/|https://www.tulsaventhood.com/|Tulsa|Tulsa and Oklahoma commercial kitchens||service@tulsahoodcleaning.com|918-856-5400|Kitchen exhaust hood cleaning service known for before and after documentation; vent hood cleaning, exhaust fan repair, and restaurant equipment cleaning for Tulsa operators.
