display_name|website_url|source_url|primary_metro|service_area|contact_name|email|phone|evidence
Exclusive Hood Cleaning|https://exclusivehoodcleaningnj.com/|https://exclusivehoodcleaningnj.com/|Monmouth County|Monmouth, Ocean, Middlesex, and surrounding New Jersey commercial kitchens|||732-676-3768|New Jersey operator with NFPA 96 certified, family-owned and operated full-service kitchen exhaust and hood cleaning across core New Jersey counties. No public email exposed, so hold in research queue.
The Hood Guys Inc|https://thehoodguysinc.com/|https://thehoodguysinc.com/|Buffalo|Buffalo, Rochester, and greater Western New York commercial kitchens|||716-650-5071|Western New York operator with restaurant hood cleaning focus, explicit Buffalo and Rochester coverage, and strong kitchen exhaust relevance. No public email exposed, so hold in research queue.
Aqua Blast Professional Restaurant Cleaning and More|https://acleanhood.com/|https://acleanhood.com/|Cleveland|Madison, Perry, Geneva, Ashtabula, Painesville, Mentor, Eastlake, Willoughby, Euclid, Willowick, Wickliffe, Cleveland, Beechwood, and Chardon commercial kitchens|||216-780-4663|Family-owned Northeast Ohio operator serving restaurants since 1996 with restaurant hood cleaning, kitchen exhaust system relevance, and a detailed local service-area list. No public email exposed, so hold in research queue.
Elite Hood Cleaning Wisconsin|https://elitehoodcleaningwisconsin.com/|https://elitehoodcleaningwisconsin.com/|Hartland|Hartland, Milwaukee, Waukesha, Madison, and Southern Wisconsin commercial kitchens|||414-939-4393|Locally owned and family-operated Wisconsin operator with hood cleaning and kitchen exhaust coverage across Southern and Southeastern Wisconsin. No public email exposed, so hold in research queue.
Hood Guardian Services|https://www.hoodguardianservice.com/|https://www.hoodguardianservice.com/|Butte|Butte, Bozeman, Missoula, Billings, and broader Montana commercial kitchens|||406-223-5708|Montana-based firefighter-owned operator with NFPA 96 compliant commercial kitchen exhaust cleaning, full-system hood, duct, and exhaust-fan cleaning, and strong fire-safety documentation. No public email exposed, so hold in research queue.
Boyz in the Hood LLC|https://www.boyzinthehoodllc.com/|https://www.boyzinthehoodllc.com/|Portland|Portland metro and within 100 miles of Portland commercial kitchens|||503-536-5704|Veteran-owned Portland operator with locally owned and family-operated hood cleaning service for the Portland metro and nearby Oregon commercial kitchens. No public email exposed, so hold in research queue.
All Good Hood Co.|https://allgoodhood.com/|https://allgoodhood.com/|Bend|Bend, Redmond, Sisters, Sunriver, Prineville, and La Pine commercial kitchens||||Central Oregon operator focused on commercial kitchen hood and exhaust cleaning for independent restaurants, cafes, food carts, and growing kitchens with NFPA 96 documentation and inspection-ready positioning. No public email or phone exposed, so hold in research queue.
AIM Kitchen Hood Cleaning|https://aimhoods.com/|https://aimhoods.com/about/|Phoenix|Phoenix, Scottsdale, Mesa, Avondale, Peoria, Glendale, Buckeye, Surprise, El Mirage, Goodyear, Tolleson, Litchfield Park, Sun City, Sun City West, Tonopah, and Waddell commercial kitchens|||480-489-2822|Phoenix operator with local kitchen exhaust and restaurant cleaning, locally owned and family-owned positioning, and explicit Phoenix-area service coverage. No public email exposed, so hold in research queue.
Mountaineer Hood and Exhaust Cleaning, LLC|https://mountaineerhoodandexhaust.com/|https://mountaineerhoodandexhaust.com/|Morgantown|Morgantown, Bridgeport, Fayetteville, and broader West Virginia commercial kitchens|||304-685-3901|Owner-operated West Virginia operator with commercial hood and exhaust cleaning, NFPA 96-guideline service, and explicit Morgantown-area fit. No public email exposed, so hold in research queue.
