display_name|website_url|source_url|primary_metro|service_area|contact_name|email|phone|evidence
QMC LLC|https://qmcchicago.com/|https://qmcchicago.com/contact-us/|Chicago|Chicago area restaurants and commercial kitchens||office@qmcchicago.com|630-860-0925|Commercial kitchen hood cleaning, exhaust hood cleaning, and kitchen exhaust cleaning for Chicago area restaurants; trusted local provider with quote and contact route.
Metro Cleaning Service|https://www.metrocleaningmn.com/|https://www.metrocleaningmn.com/restaurant-exhaust-and-hood-cleaning|Minneapolis|Minneapolis, St Paul, Bloomington, and Twin Cities metro commercial kitchens||info@metrocleaningmn.com|651-484-9799|Restaurant exhaust and hood cleaning for Minneapolis and St Paul commercial kitchens; kitchen exhaust cleaning, NFPA 96 compliance, filters, ducts, and fans.
A1 Commercial Hood Cleaning|https://www.a1commercialhoodcleaning.com/|https://www.a1commercialhoodcleaning.com/|Cleveland|Cleveland and Northeast Ohio restaurants and commercial kitchens||admin@a-1commercialhoodcleaning.com|440-949-2200|Local veteran-owned family business serving Northeast Ohio; commercial kitchen exhaust cleaning, hood system cleaning, filters, ductwork, roof fans, NFPA 96 photos and reports.
Kitchen Hood Cleaning Services LLC|https://hoodscleaning.com/|https://hoodscleaning.com/contact-us/|Seattle|Seattle commercial kitchens||info@kitchenhoodcleaningseattle.com|206-330-8685|Commercial kitchen hood cleaning and kitchen exhaust cleaning for Seattle businesses; thorough hood degreasing, kitchen safety, and compliance service.
Aable Safety Clean|https://www.aablesafetyclean.com/|https://www.aablesafetyclean.com/|Seattle|Greater Seattle area commercial kitchens||ashley@aablesafetyclean.net|425-766-8522|Commercial kitchen hood cleaning and exhaust cleaning in greater Seattle; hoods, filters, ductwork, access panels, fan units, and free estimate scheduling.
SafeHoods|https://www.safehoods.com/|https://www.safehoods.com/commercial-hood-cleaning-service|Seattle|Seattle, Bellevue, Tacoma, Everett, and Puget Sound commercial kitchens||info@safehoods.com|425-435-4444|Certified commercial kitchen hood cleaning service for Puget Sound; entire hood system, kitchen exhaust cleaning, NFPA 96 aligned cleaning, and inspection-ready support.
Extreme Hood Cleaning|https://extremehoodcleaning.com/|https://extremehoodcleaning.com/|Portland|Portland restaurants and commercial kitchens||biz@extremehoodcleaning.com|503-757-0302|Professional restaurant hood cleaning in Portland; full kitchen exhaust system cleaning, commercial hood services, NFPA 96, and quote by email.
Otter Commercial Services|https://www.ottercs.com/|https://www.ottercs.com/services|Portland|Portland and Northwest commercial kitchens||quality@ottercs.com|503-233-8120|Hood exhaust cleaning is the primary service; full hood, filter, duct, and fan degreasing in accordance with NFPA 96, with photo proof and audit-ready reports.
Jacksonville Hood Cleaning|https://jacksonvillehoodcleaning.com/|https://jacksonvillehoodcleaning.com/|Jacksonville|Jacksonville restaurants and commercial kitchens||jacksonvillehoodcleaning@gmail.com|904-551-1539|Commercial kitchen exhaust and hood cleaning in Jacksonville; certified staff, NFPA standards, restaurant service, and direct contact route.
DRS Hoods|https://drshoods.com/|https://drshoods.com/contact-us|Jacksonville|Jacksonville, St Augustine, Palm Coast, Daytona Beach, Orlando, Gainesville, and surrounding Florida markets||drshoods1@gmail.com|386-225-5915|Commercial kitchen hood and exhaust system cleaning for restaurants and food service; expert hood cleaning, NFPA 96 compliant work, and inspection-ready support.
Hoods Cleaning Experts|https://www.hoodcleaningexperts.net/|https://www.hoodcleaningexperts.net/|Miami|Miami restaurants and commercial kitchens||info@hoodcleaningexperts.net|786-600-5263|Commercial kitchen hood cleaning experts in Miami; restaurant exhaust systems, proactive scheduling, high quality service, and code compliant kitchens.
Hoodios Hood & Exhaust|https://hoodioshoodcleaning.com/|https://hoodioshoodcleaning.com/find-us-on-the-web/|Miami|Miami and surrounding South Florida commercial kitchens||info@hoodioshoodcleaning.com|786-306-8037|Miami specialist in commercial exhaust system cleaning, restaurant hood cleaning, vent hood cleaning, exhaust fan maintenance, and NFPA 96 compliance.
Waterfall Hood Service|https://www.waterfallhoodservice.com/|https://www.waterfallhoodservice.com/about|Richmond|Richmond restaurants, hotels, schools, and food facilities||info@waterfallhoodservice.com|804-464-8986|Richmond-based company specializing in commercial kitchen exhaust cleaning, maintenance, and compliance services; NFPA code 96, picture reports, and inspection-ready kitchens.
Capitol Kitchen Hood Cleaning|https://www.capitolkitchenhoodcleaning.com/|https://www.capitolkitchenhoodcleaning.com/|Washington DC|Washington DC, Maryland, and Northern Virginia commercial kitchens||capitolkitchenhoodcleaning@gmail.com|202-534-0814|Locally operated commercial exhaust hood cleaning in Washington DC; hood cleaning, filters, grease control, 24/7 availability, and compliance-ready service.
Pristine Hood Cleaning|https://www.pristinehoodcleaning.com/|https://www.pristinehoodcleaning.com/|Pittsburgh|Pittsburgh, western Pennsylvania, eastern Ohio, and northern West Virginia commercial kitchens||d.pristinehc@gmail.com|412-676-8816|NFPA 96 compliant degreased kitchen hood and exhaust cleaning; rooftop grease containment, filter exchange, preventative maintenance, and free compliance inspection.
Just Hoods KEC|https://www.justhoodskec.com/|https://www.justhoodskec.com/|Kansas City|Greater Kansas City restaurants and commercial kitchens||clean@justhoodskec.com|913-322-2900|Full service kitchen hood exhaust cleaning in greater Kansas City; full hood cleaning to NFPA 96 cleaning standards, maintenance, installations, and after-hours service.
KC Hoods|https://www.kchoods.com/|https://www.kchoods.com/|Kansas City|Kansas City commercial kitchens||frankcuellar67@gmail.com|816-520-0427|Commercial kitchen exhaust solutions for Kansas City; industrial-grade hood cleaning, exhaust hood repair, component replacement, and direct booking by phone and email.
HoodMasters|https://hoodmastersomaha.com/|https://hoodmastersomaha.com/contact-us/|Omaha|Omaha, Lincoln, and surrounding Eastern Nebraska and Western Iowa commercial kitchens||meghan@hoodmastersomaha.com|402-333-3208|Leading kitchen hood and exhaust cleaning company serving Omaha and Lincoln; commercial kitchen food and exhaust cleaning, roof-top grease containment, before and after pictures, and NFPA 96 standards.
Dyna-Kleen Services|https://www.dynakleenservicesinc.com/|https://www.dynakleenservicesinc.com/|Omaha|Omaha restaurants and commercial kitchens||rkratz22@yahoo.com|402-397-4544|Family owned and operated company providing restaurant hood cleaning, vents, ducts, and fans; commercial clients, state-of-the-art hood cleaning, and direct email contact.
All City Hood Cleaning|https://allcityhoodcleaning.com/|https://allcityhoodcleaning.com/|Milwaukee|Milwaukee and surrounding Wisconsin commercial kitchens||info@allcityhoodcleaning.com|414-931-1033|Professional kitchen grease cleaning to prevent hood fires; commercial hood cleaning, kitchen exhaust system cleaning, and flexible scheduling for compliant kitchens.
Core Hood Cleaning|https://www.corehoodcleaning.com/|https://www.corehoodcleaning.com/|San Diego|San Diego County restaurants and commercial kitchens||chase@corehoodcleaning.com|858-361-2570|NFPA 96 certified commercial kitchen exhaust cleaning in San Diego; full system pressure washing from hood to rooftop fan, photo documentation, and compliance certificate.
MGS Hood Cleaning|https://www.mgshoods.com/|https://www.mgshoods.com/|Orange County|Orange County commercial kitchens||mgshoodcleaning@gmail.com|714-599-3159|Commercial hood cleaning and maintenance programs for Orange County commercial kitchens; hood cleaning, commercial kitchen service, and free estimate route.
Best Hood Cleaning|https://besthoodcleaning.com/|https://besthoodcleaning.com/contact|Sacramento|Sacramento, Roseville, Citrus Heights, Elk Grove, Folsom, and surrounding commercial kitchens||info@besthoodcleaning.com|916-619-3435|NFPA 96 certified commercial kitchen exhaust cleaning in Sacramento; hood canopy, filters, plenum, ducts, rooftop fans, and detailed service report with photos.
Elite Pressure Pros|https://www.pressurewashingsacramento.net/|https://www.pressurewashingsacramento.net/|Sacramento|Sacramento and Northern California restaurants, cafeterias, food trucks, and commercial kitchens||info@pressurewashingsacramento.net|916-245-1050|Specialize in restaurant hood cleaning, commercial kitchen exhaust cleaning, and full NFPA 96 compliant hood system cleaning with free estimate by phone and email.
Legend Hood & Powerwashing Services|https://legendhoodservices.com/|https://legendhoodservices.com/hood-cleaning/|Sacramento|Sacramento restaurants, food trucks, and commercial kitchens||info@legendhoodservices.com|408-650-4753|Family-owned certified hood cleaning for Sacramento commercial kitchens; complete degreasing of hoods, filters, and ventilation systems, NFPA 96 fire codes, and before and after reports.
