display_name|website_url|source_url|primary_metro|service_area|contact_name|email|phone|evidence
TRP ProClean LLC|https://www.trpproclean.com/|https://www.trpproclean.com/commercial-kitchen-exhaust-cleaning|Norwich|Norwich, Connecticut, Rhode Island, and nearby eastern Connecticut commercial kitchens|||860-705-2421|Norwich operator with bare-metal NFPA 96 kitchen exhaust cleaning, trained technicians, explicit Connecticut and Rhode Island coverage, and LocalBusiness schema anchoring Norwich. No public email is exposed, so hold in research queue.
Cape Cod Hood Cleaning|https://capecodhoodcleaning.com/|https://capecodhoodcleaning.com/|Cape Cod|Cape Cod, the Islands, and Southeastern Massachusetts commercial kitchens|F.A. Vitale||508-430-2959|Long-running hood-cleaning specialist with licensed commercial hood cleaning since 1984, NFPA 96 language, named owner route, and explicit Cape Cod and Islands coverage. No public email is exposed, so hold in research queue.
ABLE HOOD CLEANING|https://www.ablehood.com/|https://www.ablehood.com/about-us-1|Boston|Boston, Everett, Newton, Wellesley, Brookline, Cambridge, and nearby Greater Boston commercial kitchens|||781-626-7090|Locally owned and operated Greater Boston hood-cleaning specialist founded in 2005 with commercial kitchen hood cleaning, NFPA 96 experts, and explicit Boston-area coverage. No public email is exposed, so hold in research queue.
Performance Hood Cleaning|https://dakotaextinguisherandsafety.com/|https://dakotaextinguisherandsafety.com/|Sturgis|Black Hills, Sturgis, Rapid City, and surrounding western South Dakota commercial kitchens|||605-490-7688|Family-owned Black Hills operator under Dakota Extinguisher and Safety with kitchen hood cleaning and filter exchange called out on the official site, plus a direct phone route for the surrounding area. No public email is exposed, so hold in research queue.
South Dakota Hood Cleaners|https://sites.google.com/view/dakotahoodcleaning/|https://sites.google.com/view/dakotahoodcleaning/about-us|Sioux Falls|Sioux Falls and nearby South Dakota commercial kitchens|||605-370-5605|Sioux Falls hood-cleaning operator with hood, exhaust, and access-panel services plus local address and direct phone route on the official Google Site. No public email is exposed, so hold in research queue.
Pro Wash of Montana|https://prowashmt.com/|https://prowashmt.com/contact|Missoula|Missoula, Hamilton, and surrounding western Montana commercial kitchens|||406-616-3355|Family-owned Missoula operator with official commercial kitchen hood cleaning and kitchen exhaust cleaning pages, NFPA-standard hood service language, and a direct local phone route. No public email is exposed, so hold in research queue.
Iowa Fire Control LLC|https://www.iowafirecontrol.net/|https://www.iowafirecontrol.net/hood_cleaning|Des Moines|Des Moines and nearby central Iowa commercial kitchens|||515-576-4440|Des Moines operator with kitchen hood cleaning to bare metal, direct office and toll-free phone routes, over 38 years in business, and explicit central Iowa coverage on the official hood-cleaning page. No public email is exposed, so hold in research queue.
SUPREME KITCHEN EXHAUST CLEANING|https://supremekitchenhoodsservicega.com/|https://supremekitchenhoodsservicega.com/hood-stove-cleaning|Augusta|Augusta, Thompson, Sandersville, and nearby east Georgia commercial kitchens|||706-231-4126|Family- and veteran-owned Georgia operator with over 20 years of hood and stove cleaning experience, explicit Augusta and Sandersville coverage, and a direct phone route on the official hood-cleaning page. No public email is exposed, so hold in research queue.
E Fire Southern Inc|https://www.efiresouthern.com/|https://www.efiresouthern.com/kitchen-systems/4705249|Gulfport|Gulfport, Biloxi, and Mississippi Gulf Coast commercial kitchens|||228-575-6275|Family-owned Gulfport operator in business since 1983 with commercial kitchen hood system service, kitchen exhaust cleaning, and hood fire-code support plus an explicit Gulf Coast address and direct phone route on the official kitchen-systems page. No public email is exposed, so hold in research queue.
